260558; с.Воронів; вул.Бічна, 2, с.Воронів, Рогатинський р-н, Івано-Франківська обл., 77020 (відділення зв’язку, зала);мала;24.570974,49.490070
260559; с.Липівка; пл.Містечок, 1, с.Липівка, Рогатинський р-н, Івано-Франківська обл., 77020 (будинок культури, зала);Середня;24.565912,49.516197
260560; с.Кривня; вул.Долішня Кривня, 10А, с.Кривня, Рогатинський р-н, Івано-Франківська обл., 77020 (сільський клуб, зала);мала;24.588244,49.508182
260561; с.Кліщівна; вул.Шевченка, 11А, с.Кліщівна, Рогатинський р-н, Івано-Франківська обл., 77021 (сільський клуб, зала);мала;24.597272,49.487982
260562; с.Воскресинці; вул.Л.Українки, 4А, с.Воскресинці, Рогатинський р-н, Івано-Франківська обл., 77034 (сільський клуб, зала);Середня;24.425099,49.361270
260563; с.Григорів, с-ще Григорівська Слобода; вул.Шевченка, 12, с.Григорів, Рогатинський р-н, Івано-Франківська обл., 77063 (сільський клуб, зала) / вул.Шевченка, 10, с.Григорів, Рогатинський р-н, Івано-Франківська обл., 77063;мала;24.427960,49.330835
260564; с.Дегова; вул.Шевченка, 9, с.Дегова, Рогатинський р-н, Івано-Франківська обл., 77019 (сільський клуб, зала) / вул.Шевченка, 2, с.Дегова, Рогатинський р-н, Івано-Франківська обл., 77019;мала;24.477378,49.422576
260565; с.Приозерне; вул.Долішня, 2, с.Приозерне, Рогатинський р-н, Івано-Франківська обл., 77018 (сільський клуб, зала);мала;24.466283,49.415205
260566; с.Дички; вул.Зелена, 131, с.Дички, Рогатинський р-н, Івано-Франківська обл., 77012 (сільський клуб, зала);мала;24.513650,49.473056
260567; с.Яглуш; вул.Центральна, 123, с.Яглуш, Рогатинський р-н, Івано-Франківська обл., 77012 (сільський клуб, зала);мала;24.486724,49.484323
260568; с.Малий Заланів, с.Заланів; вул.Центральна, 17А, с.Заланів, Рогатинський р-н, Івано-Франківська обл., 77012 (будинок культури, зала);мала;24.539815,49.463546
260569; с.Добринів, с.Корчунок; вул.Л.Мартовича, 9, с.Добринів, Рогатинський р-н, Івано-Франківська обл., 77025 (будинок культури, зала);Середня;24.707582,49.444489
260570; с.Долиняни; вул.Центральна, 4, с.Долиняни, Рогатинський р-н, Івано-Франківська обл., 77017 (будинок культури, зала);Середня;24.407225,49.425959
260571; с.Жовчів; вул.Центральна, 1, с.Жовчів, Рогатинський р-н, Івано-Франківська обл., 77045 (будинок культури, зала);мала;24.717601,49.360286
260572; с.Данильче; вул.Черемшини, 13, с.Данильче, Рогатинський р-н, Івано-Франківська обл., 77045 (сільський клуб, зала);мала;24.705232,49.367801
260573; с.Княгиничі; вул.Шухевича, 6, с.Княгиничі, Рогатинський р-н, Івано-Франківська обл., 77030 (школа, актова зала);мала;24.466153,49.381487
260574; с.Загір’я; вул.Шевченка, 2А, с.Загір’я, Рогатинський р-н, Івано-Франківська обл., 77031 (сільський клуб, зала);мала;24.475039,49.381716
260575; с.Козарі; вул.Центральна, 95, с.Козарі, Рогатинський р-н, Івано-Франківська обл., 77064 (будинок культури, зала);Середня;24.454913,49.249487
260576; с.Журавеньки; вул.Б.Хмельницького, 50А, с.Журавеньки, Рогатинський р-н, Івано-Франківська обл., 77064 (школа, фойє);мала;24.374055,49.241765
260577; с.Колоколин; вул.Миру, 55, с.Колоколин, Рогатинський р-н, Івано-Франківська обл., 77060 (сільська рада, зала засідань);мала;24.495037,49.300254
260578; с.Конюшки; вул.Галицька, 75А, с.Конюшки, Рогатинський р-н, Івано-Франківська обл., 77036 (будинок культури, зала);Середня;24.600733,49.320523
260579; с.Березівка; вул.Хомина, 12, с.Березівка, Рогатинський р-н, Івано-Франківська обл., 77036 (бібліотека, читальна зала);мала;24.544185,49.333523
260580; с.Луковець-Вишнівський; вул.Шевченка, 42, с.Луковець-Вишнівський, Рогатинський р-н, Івано-Франківська обл., 77052 (сільський клуб, зала);мала;24.344924,49.295634
260581; с.Луковець-Журівський; вул.Голешівська, 38, с.Луковець-Журівський, Рогатинський р-н, Івано-Франківська обл., 77052 (ФАП, каб.1);мала;24.325100,49.301594
260582; с.Лучинці; вул.Шевченка, 20А, с.Лучинці, Рогатинський р-н, Івано-Франківська обл., 77046 (сільський клуб, зала);Середня;24.624857,49.350403
260583; с.Обельниця; вул.Шевченка, 30А, с.Обельниця, Рогатинський р-н, Івано-Франківська обл., 77047 (сільський клуб, зала);мала;24.628860,49.316376
260584; с.Нижня Липиця, с-ще Вигода; вул.Шевченка, 40, с.Нижня Липиця, Рогатинський р-н, Івано-Франківська обл., 77071 (сільський клуб, зала);мала;24.791251,49.322823
260585; с.Підвиння, с-ще Лісова; вул.Шевченка, 7, с.Підвиння, Рогатинський р-н, Івано-Франківська обл., 77000 (сільський клуб, зала);мала;24.655214,49.425269
260586; с.Кутці; вул.Незалежності, 18, с.Кутці, Рогатинськийр-н, Івано-Франківська обл., 77000 (сільський клуб, зала);мала;24.641112,49.409636
260587; с.Перенівка; вул.Шевченка, 4А, с.Перенівка, Рогатинський р-н, Івано-Франківська обл., 77000 (сільський клуб, зала);мала;24.613657,49.431246
260588; с.Підгороддя, с.Луковище; вул.Шевченка, 6, с.Підгороддя, Рогатинський р-н, Івано-Франківська обл., 77023 (сільський клуб, зала);мала;24.593864,49.441400
260589; с.Руда; вул.І.Франка, 86, с.Руда, Рогатинський р-н, Івано-Франківська обл., 77024 (сільський клуб, зала);мала;24.578942,49.460172
260590; с.Підкамінь; вул.Л.Українки, 10А, с.Підкамінь, Рогатинський р-н, Івано-Франківська обл., 77014 (сільський клуб, зала);мала;24.483809,49.450856
260591; с.Підмихайлівці; вул.Шевченка, 14А, с.Підмихайлівці, Рогатинський р-н, Івано-Франківська обл., 77050 (школа, актова зала);мала;24.453942,49.333106
260592; с.Журів; вул.Шевченка, 76А, с.Журів, Рогатинський р-н, Івано-Франківська обл., 77051 (сільський клуб, зала);мала;24.452049,49.308425
260593; с.Помонята; вул.Шевченка, 164А, с.Помонята, Рогатинський р-н, Івано-Франківська обл., 77032 (сільський клуб, зала);Середня;24.440740,49.398666
260594; с.Пуків; вул.Шевченка, 408, с.Пуків, Рогатинський р-н, Івано-Франківська обл., 77041 (будинок культури, зала) / вул.17 вересня, 18, с.Пуків, Рогатинський р-н, Івано-Франківська обл., 77041;Середня;24.695330,49.394204
260595; с.Путятинці; вул.Шевченка, 23А, с.Путятинці, Рогатинський р-н, Івано-Франківська обл., 77040 (сільський клуб, зала);Середня;24.645290,49.378051
260596; с.Сарники, с.Заливки; вул.Незалежності, 18, с.Сарники, Рогатинський р-н, Івано-Франківська обл., 77072 (школа, актова зала);Середня;24.741478,49.306889
260597; с.Діброва; вул.Центральна, 88, с.Діброва, Рогатинський р-н, Івано-Франківська обл., 77073 (школа, фойє);мала;24.735826,49.290337
260598; с.Світанок, с.Бойки, с-ще Стефанівка; вул.Жовтнева, 11, с.Світанок, Рогатинський р-н, Івано-Франківська обл., 77074 (сільська рада, зала засідань);мала;24.801233,49.290680
260599; с.Стратин, с-ще Пилипівці; пл.Шевченка, 19, с.Стратин, Рогатинський р-н, Івано-Франківська обл., 77022 (сільський клуб, зала);мала;24.705848,49.466499
260600; с.Погребівка; вул.Львівська, 8, с.Погребівка, Рогатинський р-н, Івано-Франківська обл., 77022 (колишній магазин, зала);мала;24.674515,49.496206
260601; с.Уїзд; вул.Центральна, 70А, с.Уїзд, Рогатинський р-н, Івано-Франківська обл., 77045 (школа, спортивна зала);мала;24.712998,49.334492
260602; с.Фрага; вул.Львівська, 35А, с.Фрага, Рогатинський р-н, Івано-Франківська обл., 77011 (школа, актова зала);мала;24.440561,49.471442
260603; с.Підбір’я; вул.Шевченка, 25А, с.Підбір’я, Рогатинський р-н, Івано-Франківська обл., 77011 (сільський клуб, зала);мала;24.443534,49.480462
260604; с.Беньківці; вул.Галицька, 1А, с.Беньківці, Рогатинський р-н, Івано-Франківська обл., 77014 (школа, актова зала);мала;24.452095,49.441914
260605; с.Чагрів; майдан Шевченка, 3, с.Чагрів, Рогатинський р-н, Івано-Франківська обл., 77061 (сільський клуб, зала);мала;24.534864,49.298409
260606; с.Чернів; вул.Стуса, 12, с.Чернів, Рогатинський р-н, Івано-Франківська обл., 77062 (будинок культури, зала);мала;24.453118,49.276063
260607; с.Черче; вул.Шевченка, 54, с.Черче, Рогатинський р-н, Івано-Франківська обл., 77015 (сільський клуб, зала);Середня;24.555629,49.427216
260608; с.Потік; вул.Роксолани, 12, с.Потік, Рогатинський р-н, Івано-Франківська обл., 77016 (школа, спортивна зала);Середня;24.579148,49.416719
260609; с.Залип’я; вул.Шевченка, 82, с.Залип’я, Рогатинський р-н, Івано-Франківська обл., 77016 (ФАП, оглядовий кабінет);мала;24.578761,49.435890
260610; с.Чесники; вул.Гончарівка, 2, с.Чесники, Рогатинський р-н, Івано-Франківська обл., 77042 (будинок культури, зала);Середня;24.727524,49.387526
260611; с.Юнашків; вул.І.Кліща, 2А, с.Юнашків, Рогатинський р-н, Івано-Франківська обл., 77070 (сільський клуб, зала);Середня;24.660901,49.308547
260612; с.Явче, с.Йосипівка, с-ще Межигаї; вул.Левицького, 4, с.Явче, Рогатинський р-н, Івано-Франківська обл., 77035 (школа, фойє);мала;24.505987,49.350595
260962; м.Калуш – вул.Бічна Паркова, вул.Богуна, вул.Гулака, вул.Івана Іскри, вул.Коритовського, вул.Костельна, вул.Коцюбинського, вул.Левицької-Басараб, вул.Ломоносова, вул.Марусі Чурай, вул.Міцкевича, вул.Млинівка, вул.Наливайка, вул.Нечая, вул.Паркова, вул.Роксолани, вул.Сохацького, вул.Степана Бандери, вул.Філатова, вул.Франка, вул.Чехова, вул.Шевченка, пл.Героїв; вул.Степана Бандери, 11, м.Калуш, Івано-Франківська обл., 77301 (музична школа №1, концертна зала);Середня;24.371120,49.023002
260963; м.Калуш – вул.Грушевського, вул.Рубчака; вул.Грушевського, 88, м.Калуш, Івано-Франківська обл., 77302 (стоматполіклініка, актова зала);Велика;24.360241,49.019026
260964; м.Калуш – вул.Бічна Мартинця, вул.Братів Дяченків, вул.Брукована, вул.Вигнута, вул.Відоняка, вул.Волошина, вул.Гірника, вул.Гната Мартинця, вул.Довженка, вул.Дорошенка, вул.Дружби, вул.Зарічна, вул.Карманського, вул.Кармелюка, вул.Кибальчича, вул.Княгині Ольги, вул.Кобиляка, вул.Коротка, вул.Котляревського, вул.Крип’якевича, вул.Кропивницького, вул.Лисенка, вул.Луки Загірські, вул.Маковея, вул.Марчака, вул.Мельника, вул.Миру, вул.Нижанківського, вул.Орищака, вул.Панаса Мирного, вул.Писарська, вул.Рожанського, вул.Руданського, вул.Сагайдачного, вул.Сковороди, вул.Тобілевича, вул.Федьковича, вул.Церковна, вул.Чудова, вул.Шашкевича, вул.Шота Руставелі, вул.Ярослава Мудрого, вул.Ярослава Осмомисла, вул.Яцишина; вул.Луки Загірські, 11, м.Калуш, Івано-Франківська обл., 77301 (народний дім "Просвіта", актова зала);Велика;24.368928,49.016149
260965; м.Калуш – вул.Андрія Коса, вул.Баюрака, вул.Бічна Гуцульська, вул.Бічна Орлика, вул.Бічна Хоткевича, вул.Бойківська, вул.Гайдамацька, вул.Героїв Крут, вул.Гірнича, вул.Гнатюка, вул.Головацького, вул.Гуцульська, вул.Довбуша, вул.Залізнична, вул.Залізняка, вул.Йосипа Сліпого, вул.Київська, вул.Козацька, вул.Корольова, вул.Костомарова, вул.Лімницька, вул.Львівська: 12, 43–76А., вул.Марійки Підгірянки, вул.Олександра Олеся, вул.Орлика, вул.Полуботка, вул.Рильського, вул.Спортивна, вул.Степанівної, вул.Степова, вул.Труша, вул.Хоткевича, вул.Шкрумеляка, вул.Яремчука; вул.Йосипа Сліпого, 30, м.Калуш, Івано-Франківська обл., 77307 (школа №9, фойє);Велика;24.379625,49.010917
260966; м.Калуш – вул.Богомольця, вул.Бортнянського, вул.Братів Козаків, вул.Височана, вул.Вороного, вул.Врубеля, вул.Грабівського, вул.Данила Галицького, вул.Дрогобича, вул.Заньковецької, вул.Зелена, вул.Івано-Франківська, вул.Кобринської, вул.Коперника, вул.Косарчина, вул.Куліша, вул.Кульчицької, вул.Куриласа, вул.Куровця, вул.Львівська: 2–11, 13–25., вул.Мартовича, вул.Медична, вул.Мечникова, вул.Могильницького, вул.Новацька, вул.Петлюри, вул.Підгорецька, вул.Проектна, вул.Родини Стебельських, вул.Романенка, вул.Садова, вул.Саксаганського, вул.Смольського, вул.Сосюри, вул.Старицького, вул.Стрілецька, вул.Тарнавського, вул.Тиха, вул.Тичини, пров.Лісний; вул.Івано-Франківська, 175, м.Калуш, Івано-Франківська обл., 77309 (народний дім імені А.Могильницького, актова зала);Велика;24.420178,49.030158
260967; м.Калуш – вул.Андрусяка, вул.Аркаса, вул.Бабія, вул.Бажана, вул.Березовського, вул.Вербицького, вул.Височанка, вул.Галицька, вул.Гірська, вул.Гулака-Артемовського, вул.Залісся, вул.Кобилянської, вул.Ковжуна, вул.Колесси, вул.Копальняна, вул.Купчинського, вул.Курбаса, вул.Марка Вовчка, вул.Марка Черемшини, вул.Новаківського, вул.Остапа Вишні, вул.Палідовича, вул.Пачовського, вул.Підкови, вул.Підлісна, вул.Польова, вул.Похила, вул.Родини Крушельницьких, вул.Садове товариство "Хімік", вул.Самчука, вул.Святої Варвари, вул.Сірка, вул.Сонячна, вул.Трублаїні, вул.Черняховського, вул.Шопена, вул.Шухевича, вул.Яблунева, вул.Ярослава Мартинця; вул.Ковжуна, 44, м.Калуш, Івано-Франківська обл., 77301 (коледж культури і мистецтв, хореографічна зала);Велика;24.375155,49.024246
260968; м.Калуш – вул.Банянська, вул.Белея, вул.Братів Фільчинських, вул.Виговського, вул.Глінки, вул.Грабовського, вул.Калнишевського, вул.Кривоноса, вул.Лепкого, вул.Людкевича, вул.майдан Шептицького: 3–4., вул.Петрушевича, вул.Робітнича, вул.Руська, вул.Скрипника, вул.Срібняка, вул.Стефаника, вул.Фабрична, вул.Чорновола; вул.Чорновола, 20, м.Калуш, Івано-Франківська обл., 77301 (палац культури "Мінерал", фойє, 2-й поверх);Велика;24.370942,49.029189
260969; м.Калуш – вул.Винниченка: 4–8, 10–12, 18В, 54–64., вул.Гоголя, вул.Дзвонарська, вул.майдан Шептицького: 1, 11–12., вул.Нова, вул.Підвальна, вул.Сухомлинського, вул.Фегонівка, вул.Цеглинського; вул.Дзвонарська, 4, м.Калуш, Івано-Франківська обл., 77301 (школа №3, актова зала);Велика;24.364754,49.025323
260970; м.Калуш – вул.Винниченка: 1–3, 9, 17, 19–23., вул.Каракая: 2., вул.Сівецька; вул.Сівецька, 2, м.Калуш, Івано-Франківська обл., 77304 (центр художньої творчості дітей, юнацтва та молоді, танцювальна зала);Велика;24.361270,49.024915
260971; м.Калуш – вул.Воликовича, вул.Добрівлянська, вул.Долинська, вул.Каракая: 3–25., вул.Козоріса, вул.Привокзальна, вул.Симиренка, вул.Українська; вул.Дзвонарська, 4, м.Калуш, Івано-Франківська обл., 77304 (школа №3, спортзал);Велика;24.359067,49.022312
260972; м.Калуш – вул.Біласа і Данилишина: 1–9, 11–11А, 13, 21А–76., вул.Драгоманова, вул.Малицької: 2–3., просп.Лесі Українки: 16–16А, 72–88Б.,; вул.Біласа і Данилишина, 15, м.Калуш, Івано-Франківська обл., 77304 (школа №11, спортзал);Велика;24.357195,49.026905
260973; м.Калуш – вул.Біласа і Данилишина: 10, 12, 14., вул.Кірова, вул.Олени Пчілки, вул.Павлика, вул.Тіниста, просп.Лесі Українки: 6–8, 12, 14, 27–44, 90–102.,; вул.Біласа і Данилишина, 15, м.Калуш, Івано-Франківська обл., 77304 (гімназія, актова зала);Велика;24.357207,49.026839
260974; м.Калуш – вул.Євшана: 5., вул.Малицької: 5–9., просп.Лесі Українки: 2, 4, 9–11А, 13, 15–15А, 17–17Б.,; просп.Лесі Українки, 11, м.Калуш, Івано-Франківська обл., 77304 (школа №2, актова зала);Велика;24.360439,49.032260
260975; м.Калуш – вул.Бобинського, вул.Вітовського, вул.Євшана: 4, 6–26., вул.Пушкіна: 2, 4, 6, 8, 27–31., пров.Шкільний, просп.Лесі Українки: 3, 5.,; вул.Євшана, 17, м.Калуш, Івано-Франківська обл., 77304 (школа №10, актова зала);Велика;24.364263,49.034647
260976; м.Калуш – бульв.Незалежності, вул.Євшана: 1–3., вул.Пушкіна: 15–15В.,; вул.Євшана, 17, м.Калуш, Івано-Франківська обл., 77304 (школа №10, спортзал);Велика;24.364249,49.034725
260977; м.Калуш – вул.Богдана Хмельницького: 6–8., вул.Малицької: 1, 22., вул.Пушкіна: 3–3Б, 5, 7, 11–13В., вул.Січових Стрільців: 4, 8, 14, 18, 20, 22, 24, 26–28, 30, 32, 36, 38, 40, 42, 50, 62–64., просп.Лесі Українки: 1.,; вул.Богдана Хмельницького, 2, м.Калуш, Івано-Франківська обл., 77303 (політехнічний коледж, актова зала);Велика;24.358642,49.036542
260978; м.Калуш – вул.Богдана Хмельницького: 12–14, 16, 18, 20, 22, 24., вул.Руднєва, вул.Січових Стрільців: 1–3, 5–7, 11, 31, 37, 39, 41, 45, 51–53, 67., вул.Стуса: 4–4А, 12., вул.Чайковського; вул.Богдана Хмельницького, 8А, м.Калуш, Івано-Франківська обл., 77303 (школа №7, спортзал);Велика;24.358799,49.039567
260979; м.Калуш – вул.Литвина: 4., вул.Січових Стрільців: 9, 13, 15–17, 19, 21, 23, 25, 29, 34Б., вул.Стуса: 10.,; вул.Литвина, 2, м.Калуш, Івано-Франківська обл., 77308 (дитячо-юнацька спортивна школа "Сокіл", зала вільної боротьби);Велика;24.359536,49.044022
260980; м.Калуш – вул.Богдана Хмельницького: 34–36, 38, 40, 42, 46, 48., вул.Січових Стрільців: 34–34А., вул.Стуса: 1–3, 5–9.,; вул.Литвина, 2, м.Калуш, Івано-Франківська обл., 77308 (дитячо-юнацька спортивна школа "Сокіл", ігрова зала);Велика;24.359701,49.043962
