Номер дільниці; Опис меж дільниці; Адреса приміщення для голосування (місцезнаходження) / Адреса дільничної виборчої комісії; Розмір дільниці; Кординати
260106; с.Бринь; вул.Галицька, 69, с.Бринь, Галицький р-н, Івано-Франківська обл., 77165 (сільський клуб, актовий зал) / вул.Галицька, 71, с.Бринь, Галицький р-н, Івано-Франківська обл., 77165;Середня;24.573375,49.046421
260107; с.Височанка; вул.Семена Височана, 67, с.Височанка, Галицький р-н, Івано-Франківська обл., 77166 (школа, приміщення початкових класів);мала;24.581768,49.017060
260108; с.Вікторів – вул.Федика: 1–319, 618–711.,; вул.Федика, с.Вікторів, Галицький р-н, Івано-Франківська обл., 77166 (школа, спортивний зал);Середня;24.649488,49.062033
260109; с.Вікторів – вул.Федика: 320–617.,; вул.Федика, школа, с.Вікторів, Галицький р-н, Івано-Франківська обл., 77166 (школа, спортивний зал);Середня;24.613809,49.045164
260130; с.Комарів, с.Сокіл; вул.Ворони, 217В, с.Комарів, Галицький р-н, Івано-Франківська обл., 77164 (школа, спортивний зал);Середня;24.645232,49.072426
260133; с.Крилос; вул.Тараса Шевченка, 15А, с.Крилос, Галицький р-н, Івано-Франківська обл., 77162 (будинок культури, зал);Середня;24.688884,49.085891
260140; с.Мединя; вул.Чорновола, 32, с.Мединя, Галицький р-н, Івано-Франківська обл., 77163 (Народний дім, актовий зал);Середня;24.575244,49.092693
260154; с.Сапогів; вул.Центральна, 110А, с.Сапогів, Галицький р-н, Івано-Франківська обл., 77165 (сільський клуб, актовий зал);мала;24.603324,49.051918
260276; с.Боднарів; вул.Тараса Шевченка, 6, с.Боднарів, Калуський р-н, Івано-Франківська обл., 77350 (народний дім, актова зала);Велика;24.533581,49.029305
260277; с.Верхня, с.Іванкова; вул.Тараса Шевченка, 92, с.Верхня, Калуський р-н, Івано-Франківська обл., 77324 (народний дім, фойє) / вул.Тараса Шевченка, 72, с.Верхня, Калуський р-н, Івано-Франківська обл., 77324;Велика;24.300342,49.098500
260278; с.Вістова; вул.Тараса Шевченка, 43, с.Вістова, Калуський р-н, Івано-Франківська обл., 77351 (народний дім, актова зала);Середня;24.474567,49.025242
260279; с.Бабин-Зарічний; вул.Тараса Шевченка, 62, с.Бабин-Зарічний, Калуський р-н, Івано-Франківська обл., 77351 (народний дім, актова зала);мала;24.509865,49.046010
260280; смт Войнилів; вул.Тараса Шевченка, 127, смт Войнилів, Калуський р-н, Івано-Франківська обл., 77312 (народний дім, фойє);Велика;24.493076,49.128087
260281; с.Довпотів; вул.Василя Стефаника, 11, с.Довпотів, Калуський р-н, Івано-Франківська обл., 77315 (школа, актова зала);Середня;24.440119,49.096237
260282; с.Середня; вул.40 років Перемоги, 36, с.Середня, Калуський р-н, Івано-Франківська обл., 77312 (народний дім, глядацька зала);мала;24.514558,49.146966
260283; с.Дубовиця; вул.Гаврилюка, 15, с.Дубовиця, Калуський р-н, Івано-Франківська обл., 77312 (народний дім, зала для виступів);мала;24.478225,49.158559
260284; с.Голинь – вул.Богачевського, вул.Василя Стуса, вул.Вороного, вул.Героїв України, вул.Грильовського, вул.Залізнична, вул.Заньковецької, вул.Зарічна, вул.Івана Франка, вул.Коновальця: 13, 15, 17, 19, 21, 23, 25, 27, 29–105., вул.Марка Вовчка, вул.Незалежності, вул.Романа Шухевича, вул.Сагайдачного, вул.Сівецька, вул.Січових Стрільців, вул.Сосюри, вул.Стебельських, вул.Степана Бандери, вул.Тараса Шевченка, вул.Чорновола, вул.Чумака, вул.Ярослава Мудрого; вул.Коновальця, 13, с.Голинь, Калуський р-н, Івано-Франківська обл., 77343 (школа, актова зала);Велика;24.249739,49.008016
260285; с.Голинь – вул.Бережницького, вул.Богдана Хмельницького, вул.Гнатюка, вул.Грінченка, вул.Зелена, вул.Івана Мазепи, вул.Івасюка, вул.Коновальця: 1–12, 14, 16, 18, 20, 22, 24, 26, 28., вул.Лесі Українки, вул.Матківської, вул.Михайла Грушевського, вул.Михайла Коцюбинського, вул.Молодіжна, вул.Назарія Яремчука, вул.Пам’яті, вул.Панаса Мирного, вул.Петлюри, вул.Просвіти, вул.Роксолани, вул.Середня, вул.Учительська, вул.Церковна, вул.600-річчя Голиня; вул.600-річчя Голиня, 18, Калуський р-н, Івано-Франківська обл., 77343 (народний дім, актова зала);Велика;24.265257,49.004153
260286; с.Добровляни; вул.Степана Бандери, 16, с.Добровляни, Калуський р-н, Івано-Франківська обл., 77361 (народний дім, зала для виступів);Середня;24.352494,48.988468
260287; с.Довгий Войнилів; вул.Тараса Шевченка, 56А, с.Довгий Войнилів, Калуський р-н, Івано-Франківська обл., 77320 (школа, актова зала) / вул.Тараса Шевченка, 60, с.Довгий Войнилів, Калуський р-н, Івано-Франківська обл., 77320;Середня;24.373013,49.155117
260288; с.Завадка, с.Болохів; вул.Івана Франка, 76А, с.Завадка, Калуський р-н, Івано-Франківська обл., 77323 (народний дім, фойє);Середня;24.239396,49.098501
260289; с.Степанівка; вул.Івана Франка, 1А, с.Степанівка, Калуський р-н, Івано-Франківська обл., 77323 (народний дім, глядацька зала);мала;24.246115,49.071099
260290; с.Завій; вул.Данила Галицького, 305А, с.Завій, Калуський р-н, Івано-Франківська обл., 77356 (народний дім, актова зала) / вул.Данила Галицького, 305, с.Завій, Калуський р-н, Івано-Франківська обл., 77356;Середня;24.420760,48.939364
260291; с.Грабівка; вул.Тараса Шевченка, 111, с.Грабівка, Калуський р-н, Івано-Франківська обл., 77357 (школа, спортивний зал);Середня;24.385283,48.894703
260292; с.Збора; вул.Молодіжна, 48, с.Збора, Калуський р-н, Івано-Франківська обл., 77322 (народний дім, зала для виступів);Середня;24.257097,49.119617
260293; с.Кулинка; вул.Зелена, 15А, с.Кулинка, Калуський р-н, Івано-Франківська обл., 77322 (народний дім, кімната завідувача народним домом);мала;24.242969,49.144597
260294; с.Кадобна; вул.Івана Франка, 78, с.Кадобна, Калуський р-н, Івано-Франківська обл., 77341 (народний дім, актова зала);Середня;24.213213,49.036614
260295; с.Копанки; вул.Степана Бандери, 5, корп.А, с.Копанки, Калуський р-н, Івано-Франківська обл., 77341 (школа, спортивний зал);Велика;24.391101,49.080962
260296; с.Кропивник; вул.Івана Франка, 159, с.Кропивник, Калуський р-н, Івано-Франківська обл., 77340 (народний дім, актова зала);Велика;24.268304,49.036547
260297; с.Лука; вул.Михайла Грушевського, 79, с.Лука, Калуський р-н, Івано-Франківська обл., 77310 (народний дім, актова зала);мала;24.500628,49.211931
260298; с.Діброва; вул.Безруких, 29, с.Діброва, Калуський р-н, Івано-Франківська обл., 77310 (народний дім, актова зала);мала;24.459172,49.221205
260299; с.Цвітова; вул.Тараса Шевченка, 26, с.Цвітова, Калуський р-н, Івано-Франківська обл., 77310 (школа, фойє);мала;24.450503,49.189625
260300; с.Мостище; вул.Робітнича, 14, с.Мостище, Калуський р-н, Івано-Франківська обл., 77331 (народний дім, актова зала);Середня;24.342229,49.067510
260301; с.Негівці; вул.Підгірна, 65, с.Негівці, Калуський р-н, Івано-Франківська обл., 77325 (школа, актовий зал) / вул.Тарантюка, 1, с.Негівці, Калуський р-н, Івано-Франківська обл., 77325;Середня;24.372747,49.128184
260302; с.Гуменів; вул.Чорновола, 99, с.Гуменів, Калуський р-н, Івано-Франківська обл., 77326 (народний дім, актова зала);мала;24.343576,49.115806
260303; с.Новиця – вул.Богдана Хмельницького, вул.Весняна, вул.Винниченка, вул.Виробнича, вул.Вишнева, вул.Вітовського, вул.Зелена, вул.Івана Мазепи, вул.Івана Франка, вул.Івасюка, вул.Лесі Українки, вул.Мартовича, вул.Миру, вул.Михайла Грушевського, вул.Михайла Коцюбинського, вул.Молодіжна, вул.Незалежності, вул.Підмарійка, вул.Тараса Шевченка: 1–65, 67, 69, 71, 73, 75, 77, 79, 81, 83.,; вул.Тараса Шевченка, 64, с.Новиця, Калуський р-н, Івано-Франківська обл., 77360 (навчально-виховний комплекс, їдальня);Середня;24.335395,48.962654
260304; с.Новиця – вул.Василя Стефаника, вул.Василя Стуса, вул.Весела, вул.Глібова, вул.Довбуша, вул.Єсеніна, вул.Карпатська, вул.Козацька, вул.Комарова, вул.Марка Черемшини, вул.Ольги Кобилянської, вул.Петрушевича, вул.Прикарпатська, вул.Січових Стрільців, вул.Тараса Шевченка: 66, 68, 70, 72, 74, 76, 78, 80, 82, 84–113., вул.Церковна, вул.Ялинка, с.Зелений Яр; вул.Тараса Шевченка, 75А, с.Новиця, Калуський р-н, Івано-Франківська обл., 77360 (народний дім, малий зал);Середня;24.333913,48.958420
260305; с.Перевозець; вул.Незалежності, 7, с.Перевозець, Калуський р-н, Івано-Франківська обл., 77332 (сільська рада, актова зала);Середня;24.539671,49.078526
260306; с.Кудлатівка; вул.Лесі Українки, 3А, с.Кудлатівка, Калуський р-н, Івано-Франківська обл., 77332 (школа, класна кімната);мала;24.505295,49.076760
260307; с.Павликівка; вул.Миру, 18Б, с.Павликівка, Калуський р-н, Івано-Франківська обл., 77332 (народний дім, актова зала);мала;24.515899,49.104574
260308; с.Слобідка; вул.Тараса Шевченка, 6, с.Слобідка, Калуський р-н, Івано-Франківська обл., 77333 (фельдшерсько-акушерський пункт, каб.2);мала;24.503751,49.081497
260309; с.Підмихайля; вул.Скородинського, 142, корп.А, с.Підмихайля, Калуський р-н, Івано-Франківська обл., 77352 (народний дім, фойє);Велика;24.386522,48.990213
260310; с.Бережниця; вул.Лисенка, 3, с.Бережниця, Калуський р-н, Івано-Франківська обл., 77353 (будинок культури, зал);Середня;24.383369,48.964573
260311; с.Пійло; вул.Михайла Грушевського, 76, с.Пійло, Калуський р-н, Івано-Франківська обл., 77344 (школа, їдальня);Велика;24.295406,49.001980
260312; с.Довге-Калуське; вул.Лесі Українки, 95, с.Довге-Калуське, Калуський р-н, Івано-Франківська обл., 77345 (народний дім, актова зала);Середня;24.305129,48.991338
260313; с.Ріп’янка; вул.Івана Франка, 9, с.Ріп’янка, Калуський р-н, Івано-Франківська обл., 77354 (народний дім, актова зала);Середня;24.486113,49.000103
260314; с.Мислів; вул.Степана Бандери, 10А, с.Мислів, Калуський р-н, Івано-Франківська обл., 77355 (народний дім, актова зала);Середня;24.497156,49.004779
260315; с.Яворівка; вул.Лесі Українки, 47А, с.Яворівка, Калуський р-н, Івано-Франківська обл., 77354 (народний дім, актова зала);мала;24.445057,48.969055
260316; с.Середній Угринів; вул.Тараса Шевченка, 123, с.Середній Угринів, Калуський р-н, Івано-Франківська обл., 77363 (народний дім, актова зала);Середня;24.357026,48.925694
260317; с.Старий Угринів; вул.Саєвича, 4, с.Старий Угринів, Калуський р-н, Івано-Франківська обл., 77362 (народний дім, актова зала);Середня;24.368281,48.952793
260318; с.Сівка-Войнилівська; вул.Центральна, 65А, с.Сівка-Войнилівська, Калуський р-н, Івано-Франківська обл., 77311 (народний дім, кімната урочистих подій);мала;24.542880,49.195181
260319; с.Довжка; вул.Миру, 15А, с.Довжка, Калуський р-н, Івано-Франківська обл., 77311 (народний дім, актова зала);мала;24.492778,49.176094
260320; с.Мошківці; вул.Братів Косарів, 32А, с.Мошківці, Калуський р-н, Івано-Франківська обл., 77311 (народний дім, актова зала);мала;24.550338,49.190455
260321; с.Сівка-Калуська; вул.Івана Франка, 49, с.Сівка-Калуська, Калуський р-н, Івано-Франківська обл., 77342 (народний дім, актова зала);Середня;24.292001,49.032431
260322; с.Станькова; вул.Галицька, 211, с.Станькова, Калуський р-н, Івано-Франківська обл., 77321 (народний дім, актова зала);Середня;24.297130,49.152037
260323; с.Студінка; вул.Панаса Мирного, 5, с.Студінка, Калуський р-н, Івано-Франківська обл., 77334 (народний дім, актова зала);Середня;24.466887,49.045131
260324; с.Середній Бабин; вул.Степана Бандери, 5, с.Середній Бабин, Калуський р-н, Івано-Франківська обл., 77335 (народний дім, актова зала);мала;24.503629,49.060343
260325; с.Томашівці; вул.Гургули, 18, с.Томашівці, Калуський р-н, Івано-Франківська обл., 77327 (школа, спортивний зал);Середня;24.443653,49.137728
260326; с.Перекоси; вул.Тараса Шевченка, 44, с.Перекоси, Калуський р-н, Івано-Франківська обл., 77328 (народний дім, актова зала);Середня;24.390335,49.164943
260327; с.Тужилів; вул.Якубова, 8, с.Тужилів, Калуський р-н, Івано-Франківська обл., 77346 (народний дім, актова зала);Середня;24.254994,48.988741
260538; м.Рогатин – вул.Миру, вул.Ольги Кобилянської, вул.Петра Шеремети; вул.Миру, 1, м.Рогатин, Рогатинський р-н, Івано-Франківська обл., 77000 (товариство сприяння обороні України, фойє);мала;24.609190,49.398513
260539; м.Рогатин – вул.Богдана Хмельницького, вул.Богуна, вул.Бориса Кудрика: 15, 19, 21–23, 25, 29–31., вул.Галицька: 1 к.А–59, 61, 63, 69, 71, 77, 79, 81–81 к.А, 83, 85., вул.Данила Галицького, вул.Драгоманова, вул.Завода, вул.Зарічна, вул.Коновальця, вул.Коцюбинського, вул.Крип’якевича, вул.Левицького, вул.Лесі Українки, вул.Липова, вул.Михайла Грушевського, вул.Надрічна, вул.Пасічна, вул.Петра Могили, вул.Поповича, вул.Роксолани, вул.Степана Бандери: 1–12, 15, 17, 19, 21–25., вул.Угрина Безгрішного, вул.Яричевського, пл.Роксолани; вул.Галицька, 36, м.Рогатин, Рогатинський р-н, Івано-Франківська обл., 77000 (будинок школяра, зала);Велика;24.611615,49.406179
260540; м.Рогатин – вул.Богдана Лепкого, вул.Бориса Кудрика: 1–14, 16–18, 20, 24, 26, 32–40., вул.Валова, вул.Відродження, вул.Володимира Винниченка, вул.Володимирська, вул.Галицька: 60, 62, 64, 70, 72–76, 78, 80, 82, 84, 88–123., вул.Городецького, вул.Грицая, вул.Івана Франка, вул.Крушельницьких, вул.Мазепи, вул.Михайла Галущинського, вул.Міцькевича, вул.Молодіжна, вул.Незалежності, вул.Нова, вул.Осмомисла, вул.Панаса Мирного, вул.Перенівська, вул.Польова, вул.Садова, вул.Січових Стрільців, вул.Старомлинська, вул.Тараса Шевченка: 1–28, 31., вул.Тичини, вул.Турянського, вул.Фортечна, вул.Чорновола, вул.Шашкевича, пров.Грицая; вул.Шашкевича, 61, м.Рогатин, Рогатинський р-н, Івано-Франківська обл., 77000 (агроколедж, актова зала);Велика;24.612801,49.411994
260541; м.Рогатин – вул.Василя Стуса, вул.Володимира Івасюка, вул.Європейська, вул.Зелена, вул.Івана Телев’яка, вул.Мирона Тарнавського, вул.Панькевича, вул.Святомиколаївська, вул.Симона Петлюри, вул.Степана Бандери: 14, 16, 18, 20, 26–124., вул.Тараса Шевченка: 30, 32–223., вул.Юрія Рогатинця; вул.Шевченка, 136, м.Рогатин, Рогатинський р-н, Івано-Франківська обл., 77000 (будинок культури, фойє);Середня;24.623242,49.410921
260542; смт Букачівці, с.Букачівська Слобода, с.Витань; вул.Чорновола, 21, смт Букачівці, Рогатинський р-н, Івано-Франківська обл., 77065 (народний дім, зала);Середня;24.498027,49.259011
260543; с.Посвірж; вул.Шевченка, 22А, с.Посвірж, Рогатинський р-н, Івано-Франківська обл., 77065 (сільський клуб, зала);мала;24.470380,49.265790
260544; с.Бабухів; вул.Бандери, 156, с.Бабухів, Рогатинський р-н, Івано-Франківська обл., 77037 (сільський клуб, зала);Середня;24.608546,49.358042
260545; с.Васючин; вул.Р.Левицького, 263, с.Васючин, Рогатинський р-н, Івано-Франківська обл., 77033 (сільський клуб, зала);Середня;24.466537,49.354325
260546; с.Вільхова; вул.Которини, 335А, с.Вільхова, Рогатинський р-н, Івано-Франківська обл., 77050 (ФАП, каб.1);мала;24.490027,49.326494
260547; с.Вербилівці; вул.С.Городецького, 14А, с.Вербилівці, Рогатинський р-н, Івано-Франківська обл., 77005 (сільський клуб, зала);Середня;24.609006,49.388413
260548; с.Залужжя; вул.С.Бандери, 24А, с.Залужжя, Рогатинський р-н, Івано-Франківська обл., 77006 (сільський клуб, зала);Середня;24.599088,49.403694
260549; с.Верхня Липиця; вул.Центральна, 11А, с.Верхня Липиця, Рогатинський р-н, Івано-Франківська обл., 77043 (будинок культури, зала) / вул.Центральна, 1А, с.Верхня Липиця, Рогатинський р-н, Івано-Франківська обл., 77043;Середня;24.781655,49.352703
260550; с.Гоноратівка; вул.Центральна, 21А, с.Гоноратівка, Рогатинський р-н, Івано-Франківська обл., 77043 (ФАП, каб.1);мала;24.769815,49.407007
260551; с.Городиська, с.Зеленів; вул.Л.Українки, 25А, с.Зеленів, Рогатинський р-н, Івано-Франківська обл., 77043 (сільський клуб, зала);мала;24.806165,49.368682
260552; с.Малинівка; вул.Шевченка, 2А, с.Малинівка, Рогатинський р-н, Івано-Франківська обл., 77043 (сільський клуб, зала);мала;24.822512,49.349637
260553; с.Лопушня; вул.Центральна, 30А, с.Лопушня, Рогатинський р-н, Івано-Франківська обл., 77044 (сільський клуб, зала);мала;24.773041,49.379676
260554; с.Виспа; вул.Шевченка, 52, с.Виспа, Рогатинський р-н, Івано-Франківська обл., 77010 (сільський клуб, зала);мала;24.449548,49.498583
260555; с.Любша; вул.Зелена, 59А, с.Любша, Рогатинський р-н, Івано-Франківська обл., 77010 (школа, актова зала);мала;24.442184,49.493193
260556; с-ще Кам’янка, с.Мельна; вул.Золота, 8, с.Мельна, Рогатинський р-н, Івано-Франківська обл., 77010 (ФАП, каб.1);мала;24.461518,49.525943
260557; с.Вишнів, с.Зруб; вул.Гора, 188, с.Вишнів, Рогатинський р-н, Івано-Франківська обл., 77063 (сільський клуб, зала);мала;24.392660,49.276775
